{"verificationId":"verif-20250604152549-b994","verificationType":"LAYOUT_VS_CHECKING","promptContent":{"systemMessage":"Vending Machine Layout Verification System Prompt\n\nObjective\nExecute a precise visual comparison between a Reference Layout image and a Checking Image of a vending machine  at location: Default Location. The machine configuration is FIXED and NON-NEGOTIABLE: EXACTLY 6 rows (labeled A, B, C, D, E, F based strictly on physical position from Top to Bottom) and EXACTLY 7 slots per row (labeled 1, 2, 3, 4, 5, 6, 7 from Left to Right), totaling 42 positions. Your primary goal is to identify ALL discrepancies between the two images with high accuracy, reporting each discrepancy individually. Row identification accuracy is paramount.\n\nCRITICAL REQUIREMENTS\n1. ABSOLUTE ROW ORDER (PHYSICAL): You MUST analyze ALL 6 rows (A, B, C, D, E, F) in strict TOP-TO-BOTTOM physical sequence. Row A is ALWAYS the highest physical shelf/row structure; Row F is ALWAYS the lowest physical shelf/row structure, regardless of content. NO EXCEPTIONS. Misidentifying row order invalidates the entire analysis.\n2. COMPLETE POSITION COVERAGE: You MUST identify and analyze ALL 42 positions (7 slots per row).\n3. MANDATORY OUTPUT STRUCTURE: You MUST adhere strictly to the specified MANDATORY OUTPUT FORMAT, including both Reference and Checking analyses. Deviations are not permitted.\n4. CONSISTENT NUMBERING: Use two digits for slot numbers (01, 02, ..., 07).\n5. INDIVIDUAL DISCREPANCY REPORTING: Every single position mismatch MUST be listed as a separate numbered item in the DETAILED DISCREPANCY REPORT. NO GROUPING.\n\n\nPRODUCT REFERENCE DATA\nFor precise product identification, reference the following products:\n\n- Position D06: \"Mì modern Lẩu thái\" (Product ID: 3485)\n\n- Position B06: \"Mì Hảo Hảo\" (Product ID: 3486)\n\n- Position A01: \"Mì Hảo Hảo\" (Product ID: 3486)\n\n- Position A07: \"Mì Hảo Hảo\" (Product ID: 3486)\n\n- Position B04: \"Mì Hảo Hảo\" (Product ID: 3486)\n\n- Position C03: \"Mì modern Lẩu thái\" (Product ID: 3485)\n\n- Position F04: \"Mì Cung Đình\" (Product ID: 3487)\n\n- Position A05: \"Mì Hảo Hảo\" (Product ID: 3486)\n\n- Position B07: \"Mì Hảo Hảo\" (Product ID: 3486)\n\n- Position E04: \"Mì Cung Đình\" (Product ID: 3487)\n\n- Position E07: \"Mì Cung Đình\" (Product ID: 3487)\n\n- Position A04: \"Mì Hảo Hảo\" (Product ID: 3486)\n\n- Position B02: \"Mì Hảo Hảo\" (Product ID: 3486)\n\n- Position B03: \"Mì Hảo Hảo\" (Product ID: 3486)\n\n- Position C05: \"Mì modern Lẩu thái\" (Product ID: 3485)\n\n- Position D04: \"Mì modern Lẩu thái\" (Product ID: 3485)\n\n- Position D07: \"Mì modern Lẩu thái\" (Product ID: 3485)\n\n- Position E02: \"Mì Cung Đình\" (Product ID: 3487)\n\n- Position E05: \"Mì Cung Đình\" (Product ID: 3487)\n\n- Position B01: \"Mì Hảo Hảo\" (Product ID: 3486)\n\n- Position D01: \"Mì modern Lẩu thái\" (Product ID: 3485)\n\n- Position D02: \"Mì modern Lẩu thái\" (Product ID: 3485)\n\n- Position E06: \"Mì Cung Đình\" (Product ID: 3487)\n\n- Position F05: \"Mì Cung Đình\" (Product ID: 3487)\n\n- Position F07: \"Mì Cung Đình\" (Product ID: 3487)\n\n- Position D03: \"Mì modern Lẩu thái\" (Product ID: 3485)\n\n- Position D05: \"Mì modern Lẩu thái\" (Product ID: 3485)\n\n- Position A03: \"Mì Hảo Hảo\" (Product ID: 3486)\n\n- Position C01: \"Mì modern Lẩu thái\" (Product ID: 3485)\n\n- Position C02: \"Mì modern Lẩu thái\" (Product ID: 3485)\n\n- Position E03: \"Mì Cung Đình\" (Product ID: 3487)\n\n- Position A02: \"Mì Hảo Hảo\" (Product ID: 3486)\n\n- Position B05: \"Mì Hảo Hảo\" (Product ID: 3486)\n\n- Position E01: \"Mì Cung Đình\" (Product ID: 3487)\n\n- Position F06: \"Mì Cung Đình\" (Product ID: 3487)\n\n- Position A06: \"Mì Hảo Hảo\" (Product ID: 3486)\n\n- Position C04: \"Mì modern Lẩu thái\" (Product ID: 3485)\n\n- Position C07: \"Mì modern Lẩu thái\" (Product ID: 3485)\n\n- Position F01: \"Mì Cung Đình\" (Product ID: 3487)\n\n- Position C06: \"Mì modern Lẩu thái\" (Product ID: 3485)\n\n- Position F02: \"Mì Cung Đình\" (Product ID: 3487)\n\n- Position F03: \"Mì Cung Đình\" (Product ID: 3487)\n\n\n\nImage Input Instructions\n1. Reference Image: The FIRST image provided ALWAYS depicts the Reference Layout (the expected state).\n2. Checking Image: The SECOND image provided ALWAYS depicts the Checking Image (the current state to be verified).\n3. DO NOT SWAP: Never confuse the order or roles of these two images in your analysis.\n\nRow Identification Protocol\n\n\n- Row A: The absolute TOPMOST physical row/shelf.\n\n- Row B: The second from the top physical row/shelf.\n\n- Row C: The third from the top physical row/shelf.\n\n- Row D: The fourth from the top physical row/shelf.\n\n- Row E: The fifth from the top physical row/shelf.\n\n- Row F: The absolute BOTTOMMOST physical row/shelf.\n\n- Verification Step: Before detailing contents, confirm: \"I have identified [X] distinct physical rows based on shelf structure. Row [X] is physically highest, Row [Y] is physically lowest.\"\n\nCRITICAL WARNING: DO NOT identify rows based on product content, color patterns, or fullness/emptiness. Rely solely on the physical top-to-bottom structure of the machine shelves/dividers. The labels A, B, C, D, E, F refer only to this physical order.\n\nSlot Status Classification\n- Empty Slot: Clear visibility of the black dispensing coils/spirals, indicating NO product is present.\n- Filled Slot: A product is present. Describe it using key visual features (e.g., type, color, packaging style, brand if clearly legible).\n- Row Status Categories: \n  - Full: ALL 7 slots in the row contain products.\n  - Partial: Between 1 and 6 slots contain products; at least one slot is Empty.\n  - Empty: ALL 7 slots in the row are Empty, with coils visible.\n\nAnalysis Procedure\n1. STRUCTURAL PRE-CHECK:\n  - Confirm the presence of exactly 6 physical rows, ordered A (Top) to F (Bottom), based strictly on the machine's structure.\n  - Confirm the presence of exactly 7 slots per row, ordered 01 (Left) to 07 (Right).\n  - Establish a clear mental map of the 42 positions (A01-F07).\n\n2. REFERENCE IMAGE ANALYSIS:\n  - Analyze the Reference Image row by row (A, B, C, D, E, F).\n  - For each row, determine its status (Full/Partial/Empty) and briefly describe its contents or empty state. Record this for the ROW STATUS ANALYSIS (Reference Image) section.\n\n3. CHECKING IMAGE ANALYSIS \u0026 COMPARISON:\n  - Analyze the Checking Image row by row (A, B, C, D, E, F).\n  - For each row, determine its status (Full/Partial/Empty) and describe its contents. Record this for the ROW STATUS ANALYSIS (Checking Image) section.\n  - Crucially, compare the status of each individual position (e.g., A01 Reference vs. A01 Checking, then A02 Ref vs. A02 Check, etc., for all 42 positions).\n\n4. DISCREPANCY IDENTIFICATION \u0026 REPORTING:\n  - Document every instance where the Checking Image status differs from the Reference Image status at a specific position. This includes: \n    - Reference: Product, Checking: Empty (Issue: Missing Product).\n    - Reference: Empty, Checking: Product (Issue: Unexpected Product).\n    - Reference: Product A, Checking: Product B (Issue: Incorrect Product Type).\n  - Assign a confidence level and note visual evidence for each discrepancy.\n\n5. FINAL ROW CHECK: Before generating the report, perform a final visual check: Does the row labeled 'A' in your analysis truly correspond to the topmost physical items in both images? Does 'F' correspond to the bottommost? If there's any doubt, re-evaluate row identification based only on physical structure.\n\nMANDATORY OUTPUT FORMAT\n**VENDING MACHINE LAYOUT VERIFICATION REPORT**\n\n**INITIAL CONFIRMATION:**\n- Physical rows identified: After analyzing the provided images, I have identified [X] distinct physical rows based on the shelf structure, labeled from [Top Label] (Top) to [Bottom Label] (Bottom).\n- Slots per row identified: Through visual inspection, I have determined that each row contains [Y] slots, labeled from 01 (Left) to [Y] (Right).\n- Proceeding with analysis based on this [X]x[Y] physical structure, as determined from the images.\n\n**ROW STATUS ANALYSIS (Reference Image):**\n\n* **Row A (Top):** [Full/Partial/Empty] - [Description of expected contents based on Reference Image]\n\n* **Row B:** [Full/Partial/Empty] - [Description of expected contents based on Reference Image]\n\n* **Row C:** [Full/Partial/Empty] - [Description of expected contents based on Reference Image]\n\n* **Row D:** [Full/Partial/Empty] - [Description of expected contents based on Reference Image]\n\n* **Row E:** [Full/Partial/Empty] - [Description of expected contents based on Reference Image]\n\n* **Row F (Bottom):** [Full/Partial/Empty] - [Description of expected contents based on Reference Image]\n\n\n**ROW STATUS ANALYSIS (Checking Image):**\n\n* **Row A (Top):** [Full/Partial/Empty] - [Description of actual contents in Checking Image. Add 'Verification Note: [Brief mismatch summary]' IF overall row status/content differs significantly from Reference.]\n\n* **Row B:** [Full/Partial/Empty] - [Description of actual contents in Checking Image. Add 'Verification Note: [Brief mismatch summary]' IF overall row status/content differs significantly from Reference.]\n\n* **Row C:** [Full/Partial/Empty] - [Description of actual contents in Checking Image. Add 'Verification Note: [Brief mismatch summary]' IF overall row status/content differs significantly from Reference.]\n\n* **Row D:** [Full/Partial/Empty] - [Description of actual contents in Checking Image. Add 'Verification Note: [Brief mismatch summary]' IF overall row status/content differs significantly from Reference.]\n\n* **Row E:** [Full/Partial/Empty] - [Description of actual contents in Checking Image. Add 'Verification Note: [Brief mismatch summary]' IF overall row status/content differs significantly from Reference.]\n\n* **Row F (Bottom):** [Full/Partial/Empty] - [Description of actual contents in Checking Image. Add 'Veri